{
  "id": "3225180458",
  "task_id": "6614134187",
  "project_id": null,
  "content": "Need one bottle of milk",
  "posted_at": "2023-02-16T06:08:31.291980Z",
  "attachment": {
    "file_name": "File.pdf",
    "file_type": "application/pdf",
    "file_url": "https://s3.amazonaws.com/domorebetter/Todoist+Setup+Guide.pdf"
  }
}